{
  "provider": "youtube",
  "video_id": "dQw4w9WgXcQ",
  "captured_at": "2026-07-24T11:05:00Z",
  "checkpoint": "1h",
  "snapshot_status": "partial",
  "metrics": {
    "impressions": 1200,
    "views": 140,
    "ctr_ratio": 0.1167,
    "watch_time_minutes": null,
    "average_view_duration_seconds": null,
    "average_percentage_viewed_ratio": null,
    "subscribers_gained": null,
    "subscribers_lost": null,
    "likes": 6,
    "comments": 1,
    "shares": 0,
    "returning_viewers": null,
    "unique_viewers": null,
    "monetized_playbacks": null,
    "estimated_revenue_usd": null
  },
  "availability": {
    "impressions": "available",
    "views": "available",
    "ctr_ratio": "available",
    "watch_time_minutes": "not_yet_processed",
    "average_view_duration_seconds": "not_yet_processed",
    "average_percentage_viewed_ratio": "not_yet_processed",
    "subscribers_gained": "not_yet_processed",
    "subscribers_lost": "not_yet_processed",
    "likes": "available",
    "comments": "available",
    "shares": "available",
    "returning_viewers": "not_applicable",
    "unique_viewers": "not_applicable",
    "monetized_playbacks": "not_applicable",
    "estimated_revenue_usd": "not_authorized"
  },
  "provider_request_reference": "mock-reports-query-0002"
}
